{
  "schema_version": "1.0",
  "metadata": {
    "tool": "kubeconfig-hygiene",
    "tool_version": "1.0.2",
    "started_at": "2026-07-21T16:00:19.063246Z",
    "completed_at": "2026-07-21T16:00:19.065806Z",
    "target": "/tmp/devops-toolkit-phase4/kubeconfig",
    "partial": false,
    "capabilities": [
      "permissions",
      "embedded-credentials",
      "certificate-expiry",
      "context-integrity",
      "exec-plugins"
    ]
  },
  "findings": [],
  "status": "pass",
  "summary": {
    "info": 0,
    "low": 0,
    "medium": 0,
    "high": 0,
    "critical": 0,
    "suppressed": 0,
    "total": 0
  },
  "extensions": {
    "inventory": {
      "files": 1,
      "clusters": 1,
      "users": 1,
      "contexts": 1
    },
    "files": [
      "/tmp/devops-toolkit-phase4/kubeconfig"
    ]
  }
}
