{
  "schema_version": "1.0",
  "metadata": {
    "tool": "secret-sentinel",
    "tool_version": "1.0.2",
    "started_at": "2026-07-21T15:06:06.999934Z",
    "completed_at": "2026-07-21T15:06:07.000883Z",
    "target": "tests/fixtures/secret-repo",
    "partial": false,
    "capabilities": [
      "working-tree",
      "git-history",
      "redaction",
      "sarif",
      "baseline"
    ]
  },
  "findings": [
    {
      "id": "SECRET-GITHUB-TOKEN",
      "tool": "secret-sentinel",
      "category": "secrets",
      "severity": "critical",
      "confidence": "high",
      "title": "GitHub token detected",
      "description": "Sensitive material appears to be stored in source-controlled or local text.",
      "recommendation": "Revoke or rotate the credential, remove it from the source and history, and replace it with workload identity or a managed secret store.",
      "fingerprint": "sha256:cc884e46086ed17dd2ca81483d3b3467cf84cd7252a58950c83f8da2485e4fc8",
      "resource": {
        "type": "File",
        "name": "config.txt"
      },
      "evidence": {
        "summary": "Detector SECRET-GITHUB-TOKEN matched in working-tree",
        "location": "config.txt",
        "line": 1
      },
      "references": [],
      "suppressed": false
    }
  ],
  "status": "fail",
  "summary": {
    "info": 0,
    "low": 0,
    "medium": 0,
    "high": 0,
    "critical": 1,
    "suppressed": 0,
    "total": 1
  },
  "extensions": {
    "metrics": {
      "files_scanned": 1,
      "files_skipped": 0
    },
    "history_enabled": false
  }
}
